{
  "schema_version": "1.0.0",
  "problem_id": "problem:sympy-counterexample-fixture",
  "title": "确定性反例 fixture",
  "aliases": [],
  "statement": {
    "text": "对所有实数 x，x^2 >= x。",
    "language": "zh-CN",
    "version": 1
  },
  "domain": {
    "description": "实数上的一元全称不等式",
    "objects": ["real number"]
  },
  "quantifiers": [
    {
      "kind": "forall",
      "variables": ["x"],
      "domain": "x ∈ ℝ"
    }
  ],
  "definitions": [],
  "assumptions": [],
  "allowed_axioms": ["ordered-field"],
  "msc": [],
  "sources": [
    {
      "source": "project fixture",
      "source_record_id": null,
      "url": "https://github.com/vibemathing/vibe-mathing-problem-public-template",
      "retrieved_at": "2026-08-13T00:00:00Z",
      "revision": "fixture-revision-1",
      "content_sha256": "2c2a1ca2e4f34f1a9a9e3bd0c74b22c999b776a299c60d5f9dd2c5d2275ecf0d",
      "quote": "对所有实数 x，x^2 >= x。",
      "license": {"name": "CC0-1.0", "attribution": "Vibe Mathing synthetic fixture"}
    }
  ],
  "acceptance": {
    "policy": "solution-admission-v1"
  },
  "constraints": {
    "allowed_methods": ["computation"],
    "allowed_adapters": ["sympy-counterexample-v1"],
    "max_attempts": 1,
    "runtime": {
      "max_transitions": 16,
      "max_retries": 2,
      "timeout_seconds": 30,
      "max_output_bytes": 1048576
    }
  },
  "lifecycle": "active",
  "created_at": "2026-08-13T00:00:00Z",
  "updated_at": "2026-08-13T00:00:00Z"
}
